"notation","title","description","id","title_en","description_en"
"","Stufe I","technische Grundlagen (Routineprozeduren auf Grundlage einfachen begrifflichen Wissens)","a9d",,
"","Stufe II","einfache Anwendungen von Grundlagenwissen (Routineprozeduren in einem klar strukturierten Kontext)","e3y",,
"","Stufe III","Erkennen und Nutzen von Zusammenhängen in einem vertrauten (mathematischen und sachbezogenen) Kontext","a5v",,
"","Stufe IV","sicheres und flexibles Anwenden von begrifflichem Wissen und Prozeduren im curricularen Umfang","c2q",,
"","Stufe V","Modellierung komplexer Probleme unter selbstständiger Entwicklung geeigneter Strategien","p2p",,